Facility ID,Facility Name,Address,Website,Sports A-D,Sports E-P,Sports S-Z,All Sports
1403.0,Smithfield Community School,175 Mount Olive Dr,https://www.toronto.ca/explore-enjoy/parks-recreation/places-spaces/parks-and-recreation-facilities/location/?id=1320,"Badminton, Badminton with Family, Basketball, Cricket",,"Soccer, Volleyball","Badminton, Badminton with Family, Basketball, Cricket, Soccer, Volleyball"
21289.0,The New Generation Youth Recreation Centre,2694 Eglinton Ave,https://www.toronto.ca/explore-enjoy/parks-recreation/places-spaces/parks-and-recreation-facilities/location/?id=474,"Badminton, Basketball","Multi-Sport, Open Gym, Pickleball",,"Badminton, Basketball, Multi-Sport, Open Gym, Pickleball"
8188.0,Cornell Junior Public School,61 Holmfirth Ter,https://www.toronto.ca/explore-enjoy/parks-recreation/places-spaces/parks-and-recreation-facilities/location/?id=1156,,"Open Gym, Open Gym with Family",,"Open Gym, Open Gym with Family"
8388.0,Davisville Public School,50 Davisville Ave,https://www.toronto.ca/explore-enjoy/parks-recreation/places-spaces/parks-and-recreation-facilities/location/?id=2831,Basketball,Pickleball,Volleyball,"Basketball, Pickleball, Volleyball"
872.0,Glamorgan Jr Public School,51 Antrim Cres,https://www.toronto.ca/explore-enjoy/parks-recreation/places-spaces/parks-and-recreation-facilities/location/?id=1201,Basketball,,,Basketball
144.0,Holy Family Community Centre,141 Close Ave,https://www.toronto.ca/explore-enjoy/parks-recreation/places-spaces/parks-and-recreation-facilities/location/?id=52,"Badminton with Family, Basketball","Multi-Sport (Girls), Open Gym (Women), Open Gym with Family, Pickleball, Pickleball with Family","Soccer, Volleyball","Badminton with Family, Basketball, Multi-Sport (Girls), Open Gym (Women), Open Gym with Family, Pickleball, Pickleball with Family, Soccer, Volleyball"
448.0,Sir Wilfrid Laurier Collegiate Institute,145 Guildwood Pkwy,https://www.toronto.ca/explore-enjoy/parks-recreation/places-spaces/parks-and-recreation-facilities/location/?id=1317,,"Open Gym, Open Gym with Family",,"Open Gym, Open Gym with Family"
859.0,Terry Fox Recreation Centre,2 Gledhill Ave,https://www.toronto.ca/explore-enjoy/parks-recreation/places-spaces/parks-and-recreation-facilities/location/?id=336,Basketball,"Open Gym with Family, Pickleball",,"Basketball, Open Gym with Family, Pickleball"
166.0,Vaughan Road Academy,529 Vaughan Rd,https://www.toronto.ca/explore-enjoy/parks-recreation/places-spaces/parks-and-recreation-facilities/location/?id=1371,,Multi-Sport,,Multi-Sport
1241.0,Victoria Village Arena,190 Bermondsey Rd,https://www.toronto.ca/explore-enjoy/parks-recreation/places-spaces/parks-and-recreation-facilities/location/?id=771,"Badminton, Basketball, Basketball (Women)","Pickleball, Pickleball with Family",,"Badminton, Basketball, Basketball (Women), Pickleball, Pickleball with Family"
615.0,West Hill Collegiate Institute,350 Morningside Ave,https://www.toronto.ca/explore-enjoy/parks-recreation/places-spaces/parks-and-recreation-facilities/location/?id=1381,Basketball,,,Basketball
178.0,Weston Collegiate Institute,100 Pine St,https://www.toronto.ca/explore-enjoy/parks-recreation/places-spaces/parks-and-recreation-facilities/location/?id=1384,Basketball,,,Basketball
704.0,Woburn Collegiate Institute,222 Ellesmere Rd,https://www.toronto.ca/explore-enjoy/parks-recreation/places-spaces/parks-and-recreation-facilities/location/?id=1395,Basketball,,,Basketball
52.0,Adam Beck Community Centre,79 Lawlor Ave,https://www.toronto.ca/explore-enjoy/parks-recreation/places-spaces/parks-and-recreation-facilities/location/?id=13,"Ball Hockey, Basketball",Pickleball,Soccer,"Ball Hockey, Basketball, Pickleball, Soccer"
,LAMP Community Health Centre,185 Fifth St,https://www.toronto.ca/explore-enjoy/parks-recreation/places-spaces/parks-and-recreation-facilities/location/?id=,Basketball,Martial Arts - Beginner,,"Basketball, Martial Arts - Beginner"
555.0,Winston Churchill Collegiate Institute,2239 Lawrence Ave E,https://www.toronto.ca/explore-enjoy/parks-recreation/places-spaces/parks-and-recreation-facilities/location/?id=1393,Basketball,,,Basketball
